emotion, text
joy,"So long November, you have been the worst month ever. Hello December!   "
anger,"FOR EVERY MiNUtE YOU'RE ANGRy, yOU lOSE SiXTy SECONdS Of hAPPiNESS. "
joy,I had a little cat which was very sick. As I liked it very much I went to a veterinary with it. He told me how to tend it and it really recovered its health. Everybody said that I had saved its life.
joy,Fell asleep at like 7 and now just waking up.. 
sadness,"@Ianncaleb @despicableAsh YOU THINK?! ): But if you die, can you even miss people? /: #thoughtsforthemind"
surprise,My mom just left my unwrapped Christmas present on the dinner room table... 
surprise, When I Let My Sister Borrow My Laptop Overnight &amp; When She Drops It Off She Fails To Mention That She Broke It. 
joy,Happiness is not best achieved by those who seek it directly. ~ Bertrand Russell  RT @anitabondi
joy,I finished my homework; an important task.
surprise,@VampedPrincessb bon bon good luck tonight I'll see you after meet me at the roxbury 
sadness,There were dry gingers and tonics prepared for the whiskies and gins which everyone hoped would drown the star 's sorrows . 
joy,After a 5 hour siesta... Library 
sadness,Exhibiting addict like behavior in my quest to locate  My stash seems to be empty #sorryimnotsorry
neutral, 92 . 
sadness,Shifted from Melbourne to Brisbane. All my old school friends gave me a party and I had to say good-bye to them all.
neutral, Do you have any hobbies like playing tennis or things like that ? 
neutral, Yes . 
joy,Another half hour of Wilcox taking notes&lt;/3
joy,"In our elation there was some suspicion that our experience had been secret , adventurous , and unique . "
joy,I should probably get to bed at a decent time tonight since I'm starting my big girl job tomorrow. 
joy,Husband is reading the 3rd Percy Jackson book aloud to the 8 year old and the 11 year old and I are working on the Christmas puzzle 
joy, OK . I'll see you then . 
sadness,Managing negative emotions can be tough.   and can be managed effectively with the use of #hypnosis.
fear,Is @KILLSTEENKILL going to commentate every match tonight? Because that would be AWESOME.  
anger,Hearing my roommate's music makes me want to punch him. 
sadness,going to watch my teammates play for the first time in 9 years without being on the court with them.  
sadness,When my cousin passed away unexpectedly and tragically (a murder).
disgust,Ewww that girl next to me was one of them spit when she talk kinda bitches ...Ughh they be the worst ones 
sadness,"I felt very sad when I lost my three Kwacha at civo Stadium when Sam Mangwana was playing some Rumba records. That was not what I expected, I wanted some Disco records."
sadness,"On one of our visits we found a representative of the Occidental Oil Company stranded there , looking most miserable and bedraggled in the morass of mud and pouring rain . "
anger,fcuk I wanted to stay at  420 .. damn 
sadness,At Ledos... found out some friends are coming down Sunday... I can't see them. I ain't seen them in 3 years... and it keeps going:(
shame,"Nobody actually looks at it apart from me , so I 'm not embarrassed about writing that there . "
sadness,Last day of mentoring at the middle school this semester has flown by
sadness,Really don't want to turn in all my football stuff tomorrow. 
surprise,I bought my first Christmas gifts of the year this week. I am already about to explode to tell what they are. I'm terrible at this 
joy,Joy and fear share the same pathway in your brain. One cannot exist at the same time as the other. Which do u choose? @DraytonBoylston
anger,Dotty flushed with annoyance . 
joy, Do you guys do anything special ? 
joy,"On a lighter note,it was good hearing @MrMawe2's on #YFM maobane..Perfect for this bright awesome summer's day we got 2day!!"
neutral, Then can you wait a few minutes ? I want to finish writing this letter . 
sadness,"Cette fille était vraiment à mon goût, mais ce n'était pas possible de son côté "
joy,LOOLkim ftw RT @kimberleySa__ TRUE. Youre going to be all fat tomorrow RT @HanaBananaz: Gonna be in the library ALL fat tomorrow .____. 
joy,"In fact they encouraged us most warmly , and we shared the general mood of elation at the overall success of the 1974 submission . "
joy,loaded the first haul now we have to unload it. #sarcasm
surprise,"Holy crap, It's still mathematically possible for me to make an A in my Primate Behavior class. #Focus #quitfuckingaround"
sadness,When I was trying for a girl who I really liked and cared for and thought she felt the same way too. But she didn't like the idea and just wanted to stay friends.
fear,Why does ppl say they're  when they know they aint . r u trying to trick ur mind. is the biggest thing right now. Check it..
joy,Gotta love procrastination.. 6 hours before my bio lab is due &amp; I'm starting it now.. What's sleeep? 
anger,Holy fuck! my stocking! wtf! Nooooooooo! God Noooooo! you monster.... 
fear,Some of the house servants were missing and everybody looked frightened . 
sadness,"Her fingers tightened on his hands , hearing the anguish in his voice . "
sadness,Tried drinking orange juice with a straw. Got clogged with pulp. .
anger,"I have grown up to be distrustful of men , doubtful of my own goodness , extremely resentful and explosively angry . "
surprise,"Carolyn watched him , caught between her astonishment at his presence here , and the sudden absolutely natural way they were talking . "
joy,"@wAnch0r oh it's not just my back. In clean terms, I basically bought myself a one way ticket to hell today. "
anger,My friend and I were to attend a very important meeting and he had promised to come and pick me up.  But he did not turn up and I felt very angry at him.
neutral, Bye ! 
sadness, I couldn't . I was bound and gagged . 
surprise,Great first half. Keep it going browns! Knock on wood. 
joy,Done working! Now goin home ant time to study 
neutral," Yes , fine . "
anger,Why does walmart have 20+ registers yet less than half are open on a daily basis? #onlyhave2items
neutral,Good game ? 
sadness,Cold boring night. 
joy,@HaleyGoodwin16 left her phone on airplane mode.... Nice excuse. Hahah time to talk to her until she falls asleep ;) haha #callme
fear,saw  on the tv stand. they smelled like a combination of and #shame. if that b*tch thinks i'm wearing them...
surprise,@gretchcarr016 trying to get on the 640 flight now...so I will get in at noon. I'm not telling my mom though. 
sadness,Are kids these days going to grow up thinking Dr. Dre just made headphones? 
joy,"In other news, I work tomorrow and then I have the rest of the week off! PTL! "
joy,Dear Barclays today you excelled yourself in utter incompetence yet again     which means yet another complaint to the FSA 
sadness, I have been working on it for a whole month and it's too late to write another . Just think of all my hard work that goes for nothing . How could I do such a thing ? 
anger,"This is the end , Jane . I don't want a girlfriend who goes out with other guys all the time . "
joy,These hip boots are pissin me off. Too many holes. Theyre filled with water. And too big.... 
joy,I have to wake up early tomorrow. -___- 
joy,"So much food.  So many wonderful guys in my life.  So many friends, such good times.  more muppets than you believe.  "
joy,ya en casa despues de una noche de jangueo maximo en la ahora a comer algo y a descansar que a las 2 hay que comer en casa de los iaios
fear, for giving me high final project scores. Now to get A's on all my finals right....  
joy,@AngryElf1 Dont worry..tomorrow you get to wrap shit presents that no one wants &amp; listen 2 the beardy twat wanging on about holly &amp; ivy.
sadness,@wymann93 what theee. they are but not you. all you do is sleep in your car in the basement HAHA
sadness,I'm gonna miss 2hrs of the Hog game tomorrow due to work. 
fear,"If you are really nervous of being out and about , invest in a personal alarm , which you should carry in your hand at all times . "
anger,Damn internet. Keeps knocking me out. I want to punch someone. management #stressed
neutral, Why ? 
sadness,"Oh god, I just got a papercut and now I'm afraid to stretch my hand in any way that could make it worse. "
fear,"As the frightened boy bolted to Gooseneck 's side , there was a scream from Fishbane 's corner where an unwary Pole had reaped the consequences of turning her back to view the drama . "
surprise,"@JordanWooten yeah, yeah. we'll see....can't ruin Christmas. "
joy,I guess tonight I'm going to T.G.I fridays with Morgan and her boyfriend....
surprise,GO  EXPECTING MORE -&gt; GOD'S method and means are  our comprehension. 
sadness,Fighting the urge to drive 45 min to Hobby Lobby today for Christmas decorations. I miss my Hobby Lobby so much. 
fear,On the way down a ski slope which was difficult and steep.
anger,"When a colleague asked me for help at work, despite the fact that he had more time to do it than I had."
anger,"Dear mr. Husemann, if you don't put the review answers up, I am not taking the test. You said this would be done 3 days ago. Gaaaah "
neutral, he is a nice guy and very considerate . I was impressed with how smart he was and he has a great sense of humor . 
sadness,This feeling was quite deep when my friend (girl) died in a car accident.
sadness,NOW people can start celebrating Christmas. Poor turkey day was forgotten this year  
joy,We Are Here To Love &amp;  Be Loved     for   and - #amwriting A #book today Wo Hoooo!
surprise,Dinner with mom..this is nice..lol 
joy,"Ap Bio grade just went up 2% , 10 more to pass the class ; Im definitely gonna pass in 1 week &amp; 1 day . #IDGAF ."
anger,He looked offended but I guessed his idea of discretion was swapping his length of lead pipe for a rubber truncheon . 
fear,When I almost fell down from some rocks because I had been acting foolishly and playing dangerously.
sadness,"Had a great time walking with the kids in the light parade, but I think the cold, wet route made me sick. "
surprise,Just finished prep for mums 50th... I'm SO #exhausted! May pass out into the tirimassu...
joy,"@annahuxy ...you've altered the titles in iTunes. Or untick sync music in iTunes and then sync, then tick sync music and sync again "
joy, Here you are . 
sadness,"Just stepped outside to get a look at the sky. Cloudy, sleeting. No chance of stargazing. "
surprise,Question: has anyone ever seriously thought that Anna Wintour reads market research? #mindblown #why
joy,"At that stage , Sunderland were good value for the lead and Mr Crosby must have been a contented man . "
fear,"I'm not afraid of tomorrow, for I have seen yesterday and I love today #less” good one!"
fear,is failure and the forerunner of failure.
joy,"me and Chris was scrapping over his keys in ict, so I scratched him and then he made my finger bleed and it just started again "
sadness,"Wish I could watch the parade, but apparently that's not done here. "
joy,"&quot;Sometimes ur is the source of ur #smile, &amp; sometimes ur smile can be the source of ur joy.&quot; Thich Nhat Hanh #quote"
surprise,Happy Thanksgiving to my  fan @_MsDannyD_ love you see at 930 oh yea 
joy,It is the supreme art of the teacher to awaken joy in creative expression and knowledge.& Albert Einstein  #education
fear,"In Washington there was understanding , but just as much disquiet about British Defence policy . "
fear,@zante03 @Mobyra &amp; u pathetic cowards didn't copy me in the post. Scared that I wuld really know how desperate you've become. ?#McCann
neutral, What kind ? 
sadness,no thanksgiving dinner today :( #evenmorehungrynow #needturkey
surprise,Happy that @MarkWright_ didn't act a tool on  back to being a fan 
joy,An fb notification at 4:15 in the afternoon with no previous statuses or wall posts made deff gonna be a club invite 
joy, Take good care of yourself . 
sadness,"@osaxy  #anger is an unecessary  layer of bad interpretation, Dnt fuel the fire. return to whats present here. Follow me"
joy,this has to be the most amazing day of my life. Or one of. 
fear,"Genghis Khan, Adolf Hitler, Benito Mussolini, Napoleon Bonaparte and LaToya Jackson all share a common of cats."
joy,Happiness may shift with the circumstances but the Joy of the Lord gives you the Victory over the circumstances.  
sadness,"when you spend enough time thinking, youll realize decisions never get easier and bad news only gets worse "
neutral," We basically sat her down and told her how we felt about her constant criticizing , and how we welcomed her advice but hoped she'd let us do our things . She understood , and now everything is a lot more peaceful . "
surprise,Bout to go visit  at work he just don't know it (:
sadness,I keep asking myself why I left school early.. 
surprise,"Practice, thai food, nao christmas tree shopping?  "
sadness,"For the more depressed and lonely people who have few if any outside contacts , counselling can appear to deepen the very feelings that it is seeking to alleviate , especially in the early stages . "
sadness, That's kind of you to say . But ... the stuff we do here hasn't really challenged me very much at all . 
sadness,It happened when I lost two very intimate friends in a car accident.
sadness,School ended today and I'm leaving some wonderful friends tomorrow! . Headed to Istanbul at high noon.
anger,Jus sum dirty yarnz naw RT @adayola: RT @Holla_skitty1: Fck u bitch...nd ur p hole
neutral," OK , Bond . "
joy,@cassengineer My. Favourite. Christmas movie. Ever. Ever. 
sadness,"Thrice isn't &quot;breaking up&quot;.. But essentially they are. ): The spring tour will be their last. Oh, my heart is crushed ): #awfulday"
surprise,there's an excessive amount of douche bags on my plane #yaaayyy 
sadness," Skim , please . That'd be very nice . Thanks ... oh no . Janna , I'm so sorry , but I've got to go . "
joy,"Had planned on spending 10 days at my mom's.  Now she's going to come up for 4 days, and we are going to bake together "
neutral, I do wish I could afford one . 
joy,A tough old night/morning    but we won eventually! Ave speed cameras @ Gla airport not that we would speed anyway ;)
fear,@cblank504 lots of Maryland action today- hopefully Field Hockey and Women's and Men's soccer will prevail - the Turtle
surprise,"Hahah, we won our own tournament! great comeback against cornerstone though."
sadness,"One woman , who already had a job and a busy life of her own , was surprised to find how sad she felt when her children left home in quick succession . "
surprise,Ibland e det bra att tappa mössan o gå tillbaka för att plocka upp den för då får man se vuxna människor i rymddräkter. 
joy,Time for the 4 1/2 hour Swim &amp; Dive banquet. 
joy,Been up since 6:20am bouncing off walls! I'm tired. May  come to your house and may you be filled w/ the of the Lord. Goodnight!
joy,I received a grade above average on a midterm (chemistry) and I expected on every below average.
joy,"This year, I’m thankful 4 my life. I'm getting 2 know myself in the Lord Jesus Christ. It is an amazing heartfelt journey.   "
fear,@sarahlydon89 big time. I saw a lot of heart to hearts 
joy,"Slept from like 6:30 to now, so i prolly wont be sleeping tonight. "
joy,That moment of elation when you realize you completed your most difficult class of the semester &amp; most likely came out with an A. :)
fear,"Looking through old Facebook photos, I noticed circa late spring 2009, aka graduation, that my eyes were bugged out.  "
joy,*Please dont let bad win* And let good flourish.....*P*L*E*A*S*E* I would love this pain to stop...*2b able2smile again* I wld leap for 
joy,Hid my phone and totally got caught up on lectures! Now I need to finish my paper and practice med calculations 
joy,I don't think you understand how happy I am that I found my red pea coat. 
sadness,My father left us for another woman.
joy,"Damn you Murphy, why does your law have to be true? Off to the library to start over on my papers. "
joy,@airick_burnknee @AubreyLeRose @LaurenWOwen @TylerTweets2 thank y'all for making today bearable..   
fear,and I'm gonna watch Smoldering Children. also my cat just jumped off the top of my fridge and I kind of wet myself. #ahsfx
fear,"Tool of RT @johninvermont: @DownWithTheBull War on terror not only hoax but impossible. Noble at first, but how to win a war on anger?"
sadness,Following this there was considerable despondency amongst the committee as there seemed to be little hope for the future . 
sadness,The family are not downhearted ; they have made many people across the country aware of the Trust and their work . 
joy,@patilynnw A fantastic Terrific Thanksgiving to you and your family. #love #peace #food.  God Bless you all. :)
joy," Now , the effort pays off . You have accomplished something . "
fear,"` Did you have a good day at the office ? "" she asked , hearing herself with horror . "
fear,"One of my fellow students had bunked field work and in my attempt to cover up for him I myself was exposed, though not directly.  We were to meet our field work supervisor and we were afraid of the consequences."
sadness,Today happened the worse thing ever: I saw you with another girl. It hurts so bad.    
joy,If ur heart hurts all the time for tht person something isn't right where's the 
surprise," Threw @ncaslang a surprise bday party in junior high, he opened the door n ran back outside ! Hahahaha"
disgust,Walmart is handing out free five hour energy drinks  #waytogoamerica
sadness,The ONLY thing that makes me feel better about  getting knocked out is that bayern beat city. 
disgust,I'm pretty sure I'm the only weirdo left in the world that hates a home cooked meal. #WishIWasntPicky
joy,My honey's birthday in 5 days... ♥ 
sadness,"@MeghanPickett ah right, cool, sure.......grey tooth   "
joy,"So much work to do tomorrow. Transcribing takes hours, finish my film presentation and decide what I want to do for my screenplay "
surprise,organizing...organizing...... interesting news are coming up... #party #music
joy,"Christmas break! Thank you to everyone who supported, loved, encouraged, and help me through the busiest and best semester of my life! "
joy,would'nt feel so good if it was'nt for PAIN!
neutral, Salesman ? 
joy,a day in the life of the Bosch house: Jerry shooting crows with his bb gun rifle #hicktown
neutral," No , I just for fun with my friends . We play two hand touch or flag football . We're too old to play tackle football . "
joy,Nothing like trying to relax when your brother is playing with a remote controlled car in the room above with sound effects. 
anger,The washing machine isn't working again . 
joy,"I love this trade for halos. Sell high on unproven pitcher, acquire OBP machine and competent defender at catcher, DFA Mathis. #angels"
surprise,I love the face people  make at me when I sing in Korean. #InternationalWhiteGirl #KpopFTW
disgust,Guys who pick up grls at the mall are CREEPS esp. Fairlane. Ugh. Why am I here! 
surprise,Peeked at my first gift left so generously by my college pal sue. Think it's a cozy fleece from fabulously preppy @vineyardvines ☃ 
fear, Why can't I call the police now ? He was definitely following me ! 
fear,My father had been involved in a car accident two years ago.  I was then very scared thinking that he would die as he lay unconscious in hospital for two weeks.
fear,"In the long run, anytime we avoid doing the right thing out of fear, we die a little inside. - John Ortberg  "
fear,"One evening, when I had gone fishing with my friends, we heard the roar of a lion near by and had to run for our lives."
surprise,Palmetto State rivalry game = 
joy,Yay English class the one class I might actually enjoy today #imsoexcited #notreally :(
surprise,don't forget that @MiguelTorresMMA mexican food recipes originate from Mexico and are dayum tasty 
fear,Tutorial again !  A fearful feeling came to me when I sat on the chair and looked at my fellow students all around.  I was really scared that they would ask me some questions or challenge the ideas that I had presented.
sadness,"To the world, you may be one person. But to a person, you may be their world.... I don't think so "
sadness,His liquid eyes were sorrowful and the ends of his moustache drooped . 
sadness,"We were all sad it was over "" . "
anger, What did you think you were doing ? 
surprise,Lekker op de bank maar eens begin maken van rijm 
fear,"As a child, one evening I had read a novel about ghosts and I had thus spent a sleepless night as I kept feeling that there were ghosts dancing around me."
anger,Being made to look like a fool by a girl.
fear,large crowds of manic football fans and mascots 
joy,"You are worthy, O Lord our God, to receive glory and honor and power! Rev. 4:11 ALL GLORY TO GOD! @spreadingJoy THANK YOU!"
fear,enjoyed church service today!!!!.....well hav dis for all  ma frends....GOD n not human......cos GOD is real n powerful!!:)
surprise,Kan die schijnheilige dat niet zelf doen?!? En vanavond zeker met de eer gaan strijken :-(  #fb
sadness,"Fall down seven times, stand up eight. ~ Japanese Proverb #depression #motivation"
fear,"«@RevRunWisdom: not afraid of tomorrow, for I have seen yesterday and I love today #less»"
surprise,"@niceaxxe @Zelia yup. But no black this time. I'm actually doing my nails again, haven't decided the color... :) "
joy, Thank you . I am very excited . 
joy,thankful 2 God 4 all the angels He surrounds my family with. Don't know how they keep their wings tucked under their shirts!  
disgust,Way to blow a 3 goal lead Devils. 
anger,I swear if my brother plays joker and the thief again........... #lasereyebeams #noreturn
anger,"Somerset are furious over suggestions that ` The Ghost "" , who took 8 for 122 , should be left out . "
sadness,I have been thinking of changing my major for a few months.  My original major was Chinese language and it blocks my way.  I have to face many problems at the sametime and I do not know what is real and virtuous.  I do not know if I am not interested in Chinese or if there are other factors which make me sad.  I am not very clear on what I can do for the study of Communication and Journalism.  I am not clear about what I can do.  What are the limitations ?   I hesitate but I feel more adjusted now.
joy,Ugh God. Let's go to work. 
anger,Have control over your anger OR it will control you. #Character #MyLife #Self Control
joy,I will add my voice to the Muppet Movie Enthusiasm Society. 
anger,"He was exasperated , but not cast down . "
joy,"When I opened my TE Score envelope, and saw I got into Physiotherapy."
anger,He says that he was so mad that he got a knife to scare them . 
joy,sometimes when you have absolutely nothing to do... the last option... homework! 
neutral, Trust me . 
surprise,Any one got a sweet place for me to live. I think its a bout time for me to move. #surprise
disgust,"I know they are working on a building site but we are just fed-up with this disruption . "" "
joy,I remembered that Tansy had said something about a pendant and Topaz being quite excited about it . 
sadness,IM ALL OUT OF BUTTER PECAN ICE CREAM! WHAT'S A BITCH TO DO? 
sadness,"He think he so in luv, he in luv wit a slut. "
fear,"I feel weak, very very weak! I wish I could have the same persistence and courage of those in   "
surprise,"Off to  for Thanksgiving break a day early, moms has no idea "
anger,A typical family argument.
joy,@postscript_IDC : INDEED ! Smmfh . And i probably won't even get my license till i start college -___-   
sadness,"When I didn't succeed to enter at the University, I felt that the college entrance course sistem prejudiced me, that my integrity, and effort weren't corresponded."
joy,"Although  really began last Sunday, we are now in a period of looking back at Christ's first coming and forward to His second. "
sadness,I want some sweets soooooo bad but this tooth of mine want allow it..!! 
joy,7:00pm Choir Cantata Tomorrow night!! Join us at the church for a wonderful holiday celebration! :-)  #Music
joy,Last year I went to see friends in Yugoslavia - two girls with whom I get along very well.
surprise,Ready for next week  day got to get my christmas things ready :) he's going to LOVE his gift 
anger,I hate it when I catch a wiff of someone elses fart.....
sadness,"When the train taking me to my military service left the station, on the platform remained relatives, projects and good times.  I had a hard year ahead."
surprise,"So, turns out I have a lot more time in the morning when I don't go on tumblr.... "
joy, A lot of things . There is a part about how old people should accept being old and stop feeling restless . You really should read it . 
fear,"While I was pushing a court roller out of a ditch, I slipped and fell down and the roller rolled back towards me -down slope-It is a miracle that I still have my legs intact."
fear,Kimberley qui me dit que ma mère est en train de voir ma prof principale après 1h30 d'attente. 
fear,Planet earth is moving through an energy cloud ..by 2012 the Mankind will have evolved Mentally*Spiritually*Physically - The this!
sadness,Time to do one of the hardest things that life entails. 
fear,When I get into the tube or the train without paying for the ticket.
surprise, Zo!! Die Thomas heeft wel een hele andere stem dan je zou denken nadat je zijn foto gezien hebt 
sadness,I asked a girl out on a date and she said no.
fear,&quot;@FredericBrussat: To live in is a life half-lived.  Spanish Proverb&quot;
joy,come home wondering whats going on and what im stuck doing tonight 
sadness,My academic result was poor and I had to repeat the second year.  I felt sad about the coming several years.
joy,When I got to know that I had passed the university entrance exam.  I thought that I had done one of the exams badly.
joy,@TheBodyShopUK is giving at Christmas time and not expecting one back
joy,Christmas music. Is the best. Period! #love #calming
sadness,"I may look fine on the outside, but I'm dying on the inside :( #death #razorblades #depression"
