emotion, text
joy,Thankful for quick bonding time w/ my little brothers!  ♥ ☺
anger,When the person I'm having the affair with won't talk to me in public.
fear,At night when I was coming from Lingadzi Inn I heard a hyena crying in the Lingadzi jungle. I was alone.
joy,Oh look. Godswordislaw is back. Just in time for the holidays. 
joy,@marissamccorkel like shit! Pretty much im a alcoholic now since I can't take pain meds lol and to top that split my incision open 
joy," To some extent , he is . And what do you think we move to a better place ? I can't see him clearly from here . "
joy,"When I saw my brother in Church, and publically accept Jesus Christ as his saviour and Lord."
joy,sweet reunion &amp; fellowship with the worlds greatest 9th graders! you'll always be my 8th graders. @shay_stegmann @gracie_roe  
sadness,That awkward moment when u drop your fudgesicle down the stairs 
anger,"He watched , felt indignant but also justified because he was right . "
joy,"i am at home and in bed and it's only ten. what is wrong with me? oh yeah, this week kicked my butt. and i have ACT. "
fear,@_AndreasHuebner: is nothing else than perverted #faith. Your ability to fear is a proof of your ability to #believe.
sadness,"John had been moved to Norfolk and promoted to Corporal and he wrote to Anne nearly every day , loving letters which helped to make her grief for her mother more bearable . "
anger,"In the Commons , Labour MPs unleashed their anger at the Liberal Democrats for promising to back the Government . "
fear,After I had managed to fail my first year at University I was scared as to what I was going to do with my future. I didn't want a mundane 9-5 job and yet I didn't know if I could pay my way through an unsubsidized year at university to settle down and continue my studies.
anger,"She looked a little less resentful than earlier , and -- dare he hope it ? -- even slightly anxious for him . "
anger,One day I was really angry when all my food was eaten by a dog. My anger was against my mother because she was careless. She didn't keep the food in a hidden and proper place.
joy,Ugh ewh math first class tomorrow I'm gonna fal sleepy
surprise,should i tell u im coming over or just show up and prepare myself for the worst   @lexdan13 hahah 
fear,is an obstacle that you can easily get around by simply paying no attention to it. Retweet.
anger,"Dear ASU, please invest in bigger cereal bowls. Sincerely, my tuition is paying for mediocre sizes #hungered"
joy,gonna wake up early to study again tommorow morning 
joy,love mock exams! they fill my day with 
surprise,I get to see my brother @BigWilly78 tommrrow he needs to cook or take me to grandma cause I know she is lol
surprise,Put the wrong water bottle in my bookbag to take to the deer stand.  
sadness,It's an ugly day today . 
neutral, So what ? 
sadness,"Just saw an injured animal still moving in the middle of the road. If I wasn't already a vegetarian, I would be now. "
fear,"I 'm so frightened the feeling will go away , it 's too fragile , and I do so want it not to break . "
sadness,Tryinh to eat lettuce but I& my tongue :( 
surprise,Baked goat cheese! :D 
fear,op school bezig met fm aan! zeker vet haha
anger," Which leg do you want to have , right leg or left one ? "
fear,We must not give in to the  must face those things we the most...
joy,my bedroom is finally tidy after atleast 2 weeks living like a tramp 
joy,"Back to school,  back to work,  back to this shittty ass food #whereareyouchristmas"
surprise,There is a medium sized child creeping down the stairs right now who thinks I cant hear them! 
joy,Just went through all my photos from Europe!! can't wait to share!! It was such an amazing experience!! 
surprise, de plaat op  en win een bij DJ Marien/Marion op www.nradio2.nl vanaf 20.00 uur
shame,"Ashamed of having frightened me , he looked at me sweetly and began to sing Italian songs to make me forget the incident "" . "
surprise,@SaluteMe_Bxtchx no yu ask her both ring nd waist size to throw her off then 
joy,@fleur_de_lotus Just some crappy drizzle... but NOT SNOW!  
disgust,@peoplemag How dare you make Ryan Gosling the 10th sexiest man of the year? Have you no eyes? Have you no taste?!   
sadness,A child beaten up by his mother.
surprise,&quot;@ally_jay313 mockery &amp; child banter isn't an effective way to present yourself in a serious issue&quot;&lt;oh you changed the subject! 
surprise,My old friend who I've fought with told me happy birthday and hugged me today :) 
joy,"Figurative arts , even more than poetry , expressed the mixed feelings of elation over past victories and fear of future incursions which the Celts inspired . "
sadness,"Creggan had never in his short life felt so desolate , and try as he did he could not rest and fall asleep . "
fear,Is it a lack of  or a of #loneliness that make people put up with bullshit
joy,No one was more pleased about Dara 's demise than Roshanara Begum . 
sadness,"Sandra Cooper , 33 , midwife and founder of the Darlington Miscarriage Association , said :  Women who have had a miscarriage experience grief but they have no record of their unborn child . "
sadness,When my grandmother died.
fear,I hate trucks. I hate truckers. Omg. I hate trucks. 
joy,@SeanQuigley204 you have incredible talent!!!! Sharing your video with everyone :) #christmas
joy,So... @TobsterTot finally on the mend as the fever has broken...but off to the docs so @HallofBen can have his first jabs. 
neutral, Yes . 
anger, Get out of here ! 
joy,Conditioning in the freezing rain and snow.. #pumped
anger,Righteous never BLOWS UP or CLAMS UP. It surveys the situation &amp; obeys GOD in spite of satanic aggravation. Via @hartramsey
joy,"feel like @saffcarey, done all my jobs. washed the trailer out head to toe. and still in my PJs. "
joy,"On reaching the Fish I let out a cry of triumph , overjoyed to have got there while conveniently forgetting the Verdon-like wall which lay above . "
sadness," I've finished the first draft , but the professor said it's poorly written . I have to rewrite it . it's so depressing . "
joy,@TheBodyShopUK it brings me to know that i'm saving animals by not eating or using them in any aspect of my life now :) #Vegan
joy,Catching up on American Horror Story and filling out my FAFSA 
joy,Time to bust out this online final and then work the rest of the day. 
neutral," I'm no better than them . They say it's mindless to sit in front of a machine all the time , but I think it's stimulating . "
fear,Sumtimes d fear of being jobless after school gives me the creeps!     of an undergraduate
joy,“@RunningQuotes: Do the work. Do the analysis. But feel your run. Feel your race. Feel the that is #running~Kara Goucher”@teaganrozmus
anger,Michael Stein was trying unsuccessfully to calm an irate customer who was arguing about his bill . 
joy,"Even falling asleep as he was , McLeish was amused at Bruce Davidson 's hopeful , proprietorial air . "
joy,"Okay, I'm done. Not completely done but done for now. Gotta wake up in less then 5 hours. "
surprise,@_Keogh ya had a savage nite isnt the word haha.. Didnt expect a thing #dirtythirty
sadness,"A group of thirty or forty downcast men stood apart in the canter of thin ring , their heads and arms hanging slack in attitudes of despair . "
surprise,@ColeQuitMan will love me in about ten minutes! 
joy," to &gt;&gt; @BossMackTopSoil. his tweets make me laugh lol -Signed, Sincerely - a happy chick ^_^"
anger,"All through his life , though Ken could be austere and stubborn to a point which provoked exasperation , his evident holiness was so blended with cheerfulness that he seldom lost the admiration and affection of his contemporaries . "
fear,Never wear headphones when you're smoking. Your parents will indefinitely come up behind you and finally discover you're a toker. 
sadness,it is imperitive that i go to ear x-tacy tomorrow. i must say my goodbyes and buy a crap ton of cds.   
disgust,i hate hearing my mom eat.. 
fear,I'm expecting an extremely important phonecall any minute now #terror #opportunity
sadness,"Last year, when I took the college entrance examinations I failed the FUVEST. It was for me the most frustrating situation because I had studied all year long, and only thought about this."
sadness," I'm sorry , I haven't decided yet.Do you mind giving me a couple of minutes ? "
anger,@Molly_Rose63 I've had it happen so much I'm tired of it. I just feel like saying I am looking for love not sex fuck faces!! 
surprise,"Im very excited for christmas this year,finally get to spend it with my mom,its been 2 years now! I will be dressed as a raindeer! "
sadness,"But it's not about the money money money. As I said, I. won't. see. my. crush. "
fear,My nigger lived for 6 years thinking he was HIV+ because his ex died of it and he tested for the 1st time this week and came out HIV- 
neutral," Use the stairs , never the elevator . "
anger,A month ago when one of my fellow workers got a promotion over me. It was just a small promotion but recognition was involved.
anger,"The king was furious at being tricked again , and by nothing more than a pair of animals , at that . "
joy,"my day consists of homework, homework, homework #nerd"
fear,"One fears many things, for example one fears going to the dentist. but as far as I am concerned this feeling is connected with the examination session."
surprise,"Surprise af, ik zou graag een fotootje plaatsen maar da's nog te vroeg, teveel  #sinterklaas"
joy,Huddersfield lost at last. Our friend will be delighted as her husband will now shave his terrible beard off now the unbeaten run ended 
fear, 9. My biggest fear is needles. I can't stand getting a shot.  
sadness,"Instead of wiping your tears, wipe away the people who created them.& "
joy,work 6-midnight at family video #not
sadness,"Vincent agreed , too low-spirited to put up any resistance . "
joy,"---&gt;&gt; For the kingdom of God is not a matter of eating and drinking, but of righteousness, peace and in the Holy Spirit, (Rom 14:17)"
joy,Idk...I just love to dance...even if I'm not that great...there's always a song in my heart...
anger,"Shaw , however , worked off most of his exasperation over the weekend winning the Durham and Cleveland County veterans ' over 50 title . "
neutral, No . What ? 
sadness,The walk to the town centre is long enough to invigorate me and short enough to avoid getting miserable from the cold . 
surprise,soo this growing natural isnt tht bad. but ima change my hair up. 
fear,False Evidence Appearing Real.
fear,@Shyniii MULTI COMBO KILL ! (avec des bisounours sadiques dedans)
joy,The last  Weekend Beta Test starts 20.00h CET / 19.00h GMT tonight! Im invited! 
sadness,How do you just lose jeans?!? I have been unsuccessfully searching for one of my pairs of jeans for like 3 months!! 
neutral," No , it will not be formal at all . It is a fun time . You will love the game show . Please dress casually . Usually there is an over abandon of drinks , so be careful with that . "
disgust,Walking doesn't count as working out. It barely counts as moving. 
neutral, 15 . 
sadness,"My child, unexpectedly started acting in a restless and disturbing way at school.  In addition his performance at school weakened."
sadness,"How did I not realize that I was sitting behind this beautiful ginger man? Oh fuck, he just read my mind and put his hood on. "
neutral, Not very much . Classical music sends me to sleep 
fear,Never let the fear and the thought of failure stop you from reaching for your dreams.  
surprise,"Schellenberg went out , closing the door , feeling totally bewildered . "
fear,My hair stood on end when I saw the bloody scene . 
anger,You about that tonight? RT @PeterJ91: I would spill my leftover chipotle...atleast my dogs got to enjoy it 
fear,Fear when fulfilling my obligations on my first night fatigue duty as a soldier.
disgust,Ew just stepped on a mammoth size snail while trying to walk into my house Not really okay with that uhh yuck 
joy,Curry for dinner tonight 
anger,There is a company that once I leave this company I will NEVER deal with.  
anger,Just bought an album and i got to upload it to my laptop and it doesn't show up the track names -.- xoxo 
anger,So pissed off.  Cant wait till practice so i can let some of this out.
sadness,"Still hoping that life isn't one big fall: from the highest clouds, to the cold, dry ground. "
joy,"So mad that I have to play Coventry and Pilgrim 3 times each this season, and Cumberland 3 times "
surprise,"@maliamorgan just by the way, i ended up getting a 99% on that math test you thought you beat me on...#maybenexttime #lol"
sadness,staging environment. private server. logged in to back-end CMS. opening the front-end in new window... too many connections... WTF? 
surprise,@albertoriental@staelviruskompa@super_ymb@ernpierre@jonathandenard@Jimmyruff97 medam Nan ki abiye pi anfom Nan AP Gen yon #KADO
sadness,BLAAAAAAAAAAAAAAAAAAAAAAAH. A week from yesterday it'll be a year since the second time I met @Justinbieber 
joy,"My Friday night shall be filled with awesomeness 'cause I totally have a life!! Jokes, I'll be editing all night! &#xA;Stay cool tweeters!!"
anger,"May , look at this mess ! You threw waste everywhere . "
joy,When I can see my parents because now I am far from them.
joy,I'd venture to say I'm about halfway through my massive paper. 
surprise,Imma get Qute today make em wish he wasnt even acting that way!! 
surprise,"My brother called... Needs money.. #takenadvantageof when I need something I get shit on, yet everyone turns to me for help. #foff"
joy,Today it's all about gambling regulation. #sarcasm
fear,"I don't death, I #fear the unknown"
anger, I'm going out anyway . Get out of my way . 
joy,Glad I went to the mall early..now I cn b lazy n wait 4 Happy Feet 1 on Sabc2 
joy," Nice meeting you , too . "
sadness,"Wow, just got a quick reminder on why I left dis bit. "
joy,Literally don't know how to do ANY of my math homework... 
fear,Two fierce eyes glared at the terror-stricken sailors . 
joy,I woke up with a  on my face &amp; in my heart saying thank u #god for allowing me to see a  beatfull day like today
anger,"@liamdaisley man, sainsburys has a Christmas playlist. We're going fucking nuts! Who really gives a shit about George Michael etc "
anger,A friend of mine told other people that I was a slattern (because of an occurence that had happened some time ago). When I heard about that I was very angry.
surprise,"Apparently,  updates my Twitter for me with game activity. "
fear,I was on the Inter Rail in Naples alone. After an evening in a restaurant I was going back to the hotel when a prostitute approached me to sell herself. I refused but as I carried on walking I felt that I was being followed by someone.
joy,@ski24_7 I will be waiting for mine next meeting... 
joy,"Science MOCK tomorrow, if I don't get a C I go on foundation. "
fear,"What is it that holds us back? What is it that stops us from reaching our true potential, and forces us to become who we wish to be!? "
fear,For real!!! RT @QTONGUEHER: Factor tweetRT @BeautiiFades This looks disgusting but tastes delicious!!!
sadness,"Watching x factor now, can't believe @drewryniewicz went home, such a talented girl!! "
joy,"Have my schedule for Aero, waiting for Tillys now.   "
fear,Its Only 1 Thing To Fear &amp; Thats Fear Itself...
joy,Word sir!!! RT @drmikemurdock:  ~  Your Depends..On What You Are Willing To Ignore.  #Dad #drMM #fb
joy,the spread gun on Contra moment + Duck Tales after school channel + cleavage = 
surprise,@SummerrMiller i set you up on a blind date 
surprise,"Since Christmas is coming up soon, I think my girlfriend is gonna be in for a treat. ;) #hohoho"
sadness,"The saddest words to me would be inconsolable, devastated, anguished, desolate,cheerless, forlorn, lost, bereaved and undone. "
sadness, It's really there ? This all seems so surreal-like it's all one big nightmare . 
joy,I 'm delighted that you were pleased with the response . 
fear,My grandfather had lung-cancer and was being nursed at home.  I felt fear when I was alone with him and he almost choked on mucus secretions.
sadness,Sheryl say she confused and don't know how to approach me. It sounds like I'm going back to counseling 
anger,Ready to hit the gym 
sadness,"If she had been paying more attention to his face she might have believed that his deeply shocked , anguished expression was not an act , put on for her benefit . "
joy,I met my girlfriend on the way and she joyfully welcomed me on the way home.
fear,"Looking through old Facebook photos, I noticed circa late spring 2009, aka graduation, that my eyes were bugged out.  "
surprise,"Van Spanje tot down under staat een  klaar, gelukkig zonder aldaar. Van te voren alles op een rij dat maakt je toch #blij"
anger,She said : ` Do n't be cross with them . 
surprise,Je commence a sortir mes affaires d'anglais. &quot; Ba Inés qu'est ce que tu fais? On sort a 15h20 ! &quot; J'adore etre a la masse parfois. 
joy," Yes , he does have Richard ’ s eyes . The baby even looks like you than Richard does . "
surprise,Best okee boxjes komt wel een beetje radio-geluid uit.. Maar hij is dan ook €15 
anger,Mr Jones exploded in anger . 
joy,  two 4-7 teams with black QBs who don't belong as starters on primetime 
fear,"The Americans were petrified of Communism , and believed Communists were aiming for world domination , via the ` domino effect "" of one country after another falling to it . "
joy,Just received the great news that I have to close tonight. 
fear,Coming down from a 4.5 day vacation that included Thanksgiving and my birthday. I'm sure I'll sleep REAAAL well tonight. 
sadness,im PHONELESS.... my phone is at the sprint store....sleeping there away from me.... lls
joy,Christmas shopping again today 
sadness,"The holidays come to an end, and the next day we had to go back to University and to the exams."
sadness,"My dog of 16 and 1/2 years - \Lord Grey\"" died in his sleep - His death caused me more and deeper sadness than I thought."""
anger,"Agnes noted with alarm that a pink flush was suffusing Dorothy 's face , a sure sign of temper , and really , thought her loyal assistant , she had every right to be cross under the circumstances . "
sadness,After receiving the grade on the paper mentioned in FEAR.
sadness,Crazy smh RT @RatherHaveJesus: Some really think that Chris Brown is God.   
anger,LMAO management explode in my pants..turned her on haha
anger,Somebody took my wristwatch and promised to have it mended and later was telling me that he couldn't give it back to me because I was rude at a certain time.
anger,They 're also pretty peeved at what they see as the Ministry of Agriculture 's failure to represent their interests adequately in Brussels . 
surprise,Diubah jadi senen RT @fidamuthia: Jeng jeng! Masih pemulihan mental pasca SEAG udh dpt kabar seminar proposal hari Rabu.
anger,"To Meryl 's vexation , the boundary wall proved to be nearly eight feet high . "
fear,odio esa sensación de muerte inminente en un examen final 
joy,Have a GREAT DAY tweeps!!! Love y'all and live w/ the of Christ today!!!
joy,going to the high school... planning on vomitting during the parade. #gross
joy,Such a blessing to see your brothers in Christ working tirelessly for the Kingdom of God.  
joy,"All during the night , over and over again , she had found it absurd that she 'd ever considered herself a happy woman . "
anger,"But his initial anger at finding the latest two victims of the insane killer 's bloodlust , blazed into an all-consuming hatred of the man who had done it . "
fear,Man I think it was dope as hell to see Suh Smash that dudes head into the ground a few times and Curb stomp him show enough the #SUH
sadness,In school and want something to eat very badly! 
neutral," Yes , sir . "
fear,How nervous the teacher feels about using this teaching unit . 
sadness,@BiebersLov anywaaaays robert got offff here so this means he prob won't follow bc aloooot of ppl will tweet him): 
surprise,Can't wait for black Friday. Buying myself birthday gifts 
fear,Obscene phone call where the person knew my name.
fear,Gleich muss ich als Volti Papa auch aufs Pferd und turnen. #fail #fuck
surprise,@holly_berry10 i chilled down a dirt road last night #exboyfriendprobz #heowesmeacarwash
joy,Finished work now going home to get ready for dance exam show tomorrow! 
neutral, Not a bit . 
anger, kidding. I made that mistake and now realize you'll never change. 
sadness,"My sister, whom I like very much, asked me for a favour which I refused her for some flimsy reason. Some time later I felt sorry for that and something like sadness."
anger,She didn't look quite so indignant as she 'd looked before . 
sadness,@AustinMahone What if i never get to meet you? then i'll just be heartbroken for life ;o OH MY. 
joy," So , want me to book the tickets again ? "
joy,When I'm upset I get on youtube and watch Chris browns take you down video a thousand times 
fear,"Christians have the of running out, but don't have the #faith in running over. #overflow."
neutral, Are you sick ? 
joy,"I was feeling really low - had been a series of fights with my siblings, been under pressure at school and wasn't going to the party I wanted to go - instead I was going out with my family. A guy called and said, in effect, that I was \nice\"" and he liked me. Hence the emotional joy."""
sadness,No walking dead tonight. 
joy,5 days till cruise with best friend  should probably get started on that homework though...   
anger,"` No , better to limit the damage , control his anger , make nothing of it , pretend he didn't mind . "
surprise,"Wait a minute, ND is on the board? "
fear,Being harrassed for being gay; suggestions of being physically beaten - acting as informal bouncer in a gay bar.
joy,back to real world..and studying. 
fear,Woke up to some out it texts from @kirklands89 this morning. Anyone know his whereabouts last night? Bet he's a para boy today! 
surprise,"HOME!!!! Such a rough trip home, but so worth it!!! "
fear,I had climbed on a cherry tree alone and there was a thick caterpillar beside my fingers. I feel disgusted by caterpillars and snakes. I was terribly afraid of the caterpillar crawling on my fingers. Out of the fear I was almost unable to climb down.
fear,Will love ever come her way? Can a man find his way into her heart? &quot;Afraid Of Love&quot; s     #read #dreams
joy,"When the marchers passed the city 's overhead railway , two trains hooted in solidarity , to the crowd 's delight . "
sadness,DARN YOU SCHOOL I WANTED TO GO TO A CONCERT TODAY!!!!:( 
neutral," I don ’ t agree with you . I maintain that we ’ re healthier , wealthier and wiser than we were a hundred years ago . "
anger,The RUC men who had conducted the police investigations were fiercely indignant and a senior officer threatened to resign . 
sadness,My parents don't know who Sylvia Plath is. What I have learnt from English Extension is how uncultured my parents are.... 
joy,"A little while ago I was in the bathroom on the floor celebrating the  return, similar to Beatrice Kiddo after she killed Bill "
anger, His face broke out and he said it was my fault ! 
fear,"Why are so many people afraid of so many things, but are rarely afraid of mediocrity? "
joy,Monday's not even over and already my weekend is jam packed!! 
fear,= False Evidence Appearing Real
joy,When I was in the sauna bath.
sadness,"....I be on heavy chill mode, just bobbin my head..then I just pause &amp; search for another song.."
neutral, She's my grandma . 
anger,When my sister came home late one day and thus disobeyed my parents.
fear,"Morning break, cold, wet and windswept, brings a bit of excitement to being up on a roof "
joy,Morning So tired :( &amp; I have a full day of lectures! Not to mention the thrill of litter picking and sweeping up of leaves 
fear,@Monsieur_soleil en plus mon mur est visible de friends of a friend. 
anger, You are not in a position to question my vision or my statement ! 
sadness,"@MorganLevesque Kikou jeune poney. Est-ce que tu vois la photo de la fat pipe sur mon compte? Pks moi, non... "
sadness,Man I wish I was back in high school. But only because I miss basketball. #pathetic
joy,"Suddenly , to her relief , the telephone rang , Joanna picked it up , wrote down the message , and came back to the table , looking elated . "
neutral, Good boy ! 
surprise,@BlondeGenious My phone died last night! I tried texting anyway lol Can't wait for tonight! 
neutral, Excuse me ? 
disgust,the awkward moment when an 'ex' calls u 'sis' WTF? Don't even go there fool! 
anger,"Darling Bob , do n't be cross if I have n't got it right , but is it one of your beloved American writers ? "
joy,Adventures at work: the ceiling panel directly above where I sit leaks. Yay. They ghetto fixed it for me.... 
neutral, It depends . 
joy, It seems you two are a good match . What qualities do you look for in a friend ? 
anger,"My girlfriend one day went out and promised to be back at 6.00 pm however she first arrived at 10.00 pm, without a message (we had to go out that evening)."
joy, Would you like to have lunch with me ? 
surprise,@Nichole_anders mayyybsss... But you wont know if i am or not because its going to be your surprise birthday party 
joy,Writing all those papers I was supposed to write last week. 
neutral, Fine ! 
joy," Oh , I like it . It's such a beautiful dance , but I can't do it well . What about you ? "
fear,Then she felt horror and pity at seeing Marcus so confused and so evidently useless . 
disgust,"“@BarackObama: Tonight, Senate Republicans voted to raise taxes on millions of working Americans&quot; speaking of ridiculous this is"
sadness,I had a dream last night and its been the fifth time i had it and every time i have i loose sumeone close to me hope everyone ok
surprise,"We sign around 4,000 new businesses every day. About 60% of the top 100 universities in the US are on   "
