emotion, text
sadness," Cue-Ball, Slaphead, Kojak, Egghead, Chrome Dome, MegaMind, Sir Recede-A-Lot, Mr No Friends.   "
surprise,My gma emails out an xmas &quot;itinerary&quot; to the fam and included is the phrase &quot;sarah wakes up (!)&quot; #iagreeitdoesnthappenoftenenough
joy,"He felt elated , warm-hearted at the sight of the place where he 'd been born . "
fear,Only positive of this game was the factor commercial
anger," This ref needs glasses . Hey ref , open your eyes ! I can ’ t believe he didn ’ t see that ! "
sadness,At the death of my friend's father and especially as this happened ten days before her wedding.
sadness,When I heard that my father had been involved in a car accident in Europe.  This happened when he had gone to get the car which had been stolen in Europe.
sadness," I'm sorry , but we usually don't do it . It is our policy . "
joy,Taking family pictures. 
sadness,Some months ago my wife gave birth to twin sisters. She had no idea of looking after babies and she felt quite oppressed. The fact that I couldn't help her caused grief to me.
fear,THE Princess of Wales has once more caused disquiet among fashion commentators by sticking to her own rules . 
neutral, After you . 
fear,"The boss sounded agitated when I spoke to him over the phone . "" "
joy,@TheBodyShopUK a weekend of christmas shopping and eating out with the boy- not seen him properly for 2 weeks!
fear,"He paused before stepping out onto the roof , a look of horror on his face . "
fear,"Not afraid of tomorrow, for I have seen yesterday and I love today #less"
fear,You gain   and confidence by every experience in which you really stop to look in the face.~ E Roosevelt
fear,"Typically , Gould 's infrequent letters home detailed only his ornithological exploits , much to the dismay of the household , who were desperate to hear news of a more personal nature . "
joy,"When my lover and I felt like we had gone full circle. And our relationship was new, fresh, vital etc. once again."
joy,Had to register online with games workshop. not sure if i unticked the &quot;send me a newsletter&quot; box.... 
joy,River island menswear xmas party = success 
anger,"Mr C took my drawing pens, without having asked for my permission first, and lost them.  He did not tell me about it till I asked him and then did not try to find them."
disgust,"Then there was the American sprinter Jesse Owens , who swept to victory in the Berlin Olympic Games of 1936 , much to the disgruntlement of Hitler . "
anger,": when your #FantasyFootball QB keeps handing off the rock to his RB, who keeps scoring rushing TD's.... #ThrowIt"
sadness,"My glasses actually broke yesterday, so now I'm blind in my own home. #thissucks"
sadness,"I'm a pimp under pressure, leave my money on the dresser. got bitches to  @fanzoid321 needs laid now #paysingum"
sadness,Not playing Skyward Sword today. 
joy,Great I get to see all of your ugly faces today. #justkiddingyourbeautiful
joy,The time when my sister had her first baby I was so happy and joyous because she stayed for two days after marriage before she had a child.
surprise,If you're ganna be two faced to your close basically best friends you're ganna get the shit that comes with it once they find out. 
anger,"The onlookers at first thought this accident was part of the show and were creased with laughter , making the poor man even more irate . "
joy,"When I was a student at the Institute doing my M.Phil degree, one of my professors called me before the convocation and told me \You have got the gold-medal (first rank) in the university and tomorrow you will be on T.V\""."""
fear,Having my luggage checked at Customs.
surprise,@mshucksmith haha! The element of like it. They'll love it lol where's the meal at?
sadness,Walking down the street and my knee just gave out on me. When I fell it looked like haha
neutral, Ha ! It's not like you've ever been one to beat around the bush . 
joy,N I'm sure ur stomach can tolerate it all smh RT @TAPnl I get to eat at the 3 houses tomorrow.. 
anger,When the bus driver failed to stop and pick me up at a bus stop.
anger,Can't Believe I Was On The Verge Of Risking Everything I Worked So Hard For.
sadness,When I received the news that my in-laws had passed away.  I depended heavily on them for their guidance and the running of their daughter's buisness.
joy,I am pleased that they have responded very positively . 
joy,"I went to buy a bicycle with my father. When I wanted to pay, my father took his purse and payed."
sadness,"@asuperfan Mari, people are speculating that the Sheriff dies next week! I might cry! I don't want it to be him! "
joy,"Last night I had a chat with a fellow student.  I had known her for about half a year, and for the first time we were speaking \the same language\""- meaning an inspiring discussion and encounter."""
joy,"Do you know what I'm looking forward to about break? Everything. Baking, knitting, shopping, sleeping, sketching, &amp; family &amp; friends. "
sadness,Breaks pretty much over already. Just a normal weekend 
anger,Oh my god stop talking I'm already late here comes the panic attack.   
joy,"When I had to undergo the final examination of secondary school, I lived together with a girlfriend. We both were afraid to fail, but it appeard that we both had passed."
joy,Just had my lunch of pizza now its time to go workout.  #studentathleteproblems
sadness,"In it a deeply depressed Spiro , 46 , makes several rambling statements about his money problems . "
joy,"Pumpkin pies, cups, spoons, latin music, learning to dance, red &amp; white checkers,  dear old friends, home. "
sadness,@ohhaiitscarli I didn't see your beautiful face today 
disgust,handshake? nah. i'll pass. i'd rather have no finger nails than those yellow horn plates you call 'nails'. im out. 
anger,I love that I can't go to Thirsty Nickel anymore without running into the squares that I started bringing there in the first place!..
joy,I love the excitement of opening up a new Apple product for the first time!  
surprise,Ah… France 2 fait pas mal. J'ai juste l'impression de voir la fanfare de @CentraleLyon
surprise,First night of break and I'm working. 
sadness,My examination results were not satisfactory even though I had tried my best.  Then I started wondering about my abilities for the major subject.  However I did not know how to choose my major subject if I were to change it.
joy,Being kicked out of my room right now..guess I'm staying in my basement for the week 
neutral, From China . 
fear,"In reality , they may have been more anxious and worried than they showed . "
sadness,Need to write 1000 words for an essay tomorrow and another 2000 for friday 
joy,School is very boring today :/ 
sadness,boom badum boom boom badum boom bass haha :'(((((
fear,Teenage psychology is nothing but common things you see every day in HS   #drama
sadness,I have high expectations for my future but if I pursue the subject in this manner I will not attain this.
anger,"When, after drinking a glass of water, I found a cockroach walking out of the glass."
fear,remember this &quot;we took your land thanks so much&quot; day that we're winning the war on terror by an AMAZING margin but keep your up people
sadness,"It can be the focus of inconsolable grief ; it inspires poetry and literature , symphonies and songs . "
joy,being forced to watch 2 football games the tv screen is spilt in half 
neutral, No . 
joy,"Birthday gifts from kids: Chewbacca bobblehead, Nerf Thor hammer, book about Rin Tin Tin. "
surprise,"Upon his arrival , he was nonplussed to find the yard and buildings deserted . "
joy,I have far too much to be  for to make a list. So I'll sacrifice my life unto You O  in   
surprise,@RedBones2067 OMG I just got so scared; the scene when the squirrel jumps out of the tree this movie is hysterical
surprise,Gonna punch @JNels4 in the face the second he looks down to read this. 
joy, In college . But I don't dance very often . What's your favourite dance ? 
sadness,"And when I first got an inkling the little was far worse than none , and I became melancholy and miserable . "
joy,@davebaldwin Love all of the articles about Autism.  We have a 12 yr. old son who has autism and he's a huge blessing in our household! 
disgust, I really feel sick in my stomach right now.... 
joy,Working the parade today for Sweet &amp; Sassy 
sadness,"@KhloeKardashian they had songs about me in middle school and elementary, the names they called me still hurt to this day. "
joy," Good morning , John ! "
neutral, OK . 
fear,Donc la même impression de déjà-vu tous les 6 mois c'est super strange ! 
joy,"It's great, great day. :) Standing firm in  and today!"
joy,The best feeling when someone tells you that you lost weight &lt;333 
joy,I finally get home from a long day of shopping and my mom tells me we are going to church. #justwhatiwanted
joy,I love giving gifts to others Least I can do after all my family does for me.
fear,"Not afraid of tomorrow, for I have seen yesterday and I love today #less"
neutral, Of course . 
joy,I'm gonna crawl in my bed and tweet my fingers off 
joy,I've been staring at this piece of paper for an hour and still haven't learned anything 
sadness,no phone network at all. You can't call or text me. Whatsapp only works at home. 
anger,cool. got my phone taken away and can't see Michael.   
anger,An enraged person only gets angrier when you say “I completely understand.”       
sadness,just got home from Shangrila..nakbuy na ng idodonate sa charity.../GMA.bukas! sayang wala si @johnodulio sa party p...
sadness,My anguish must have shown in my face and in my voice . 
sadness,"Got a package from my parents, without even a small note enclosed."
fear,"Retweet “@RevRunWisdom: not afraid of tomorrow, for I have seen yesterday and I love today #less”"
joy,Overload of Christmas spirit.   #thankyoujesusforbeinggood
sadness,@LiddleMonsta you switched to iPhone!!!! had no idea... gotta delete u a a bbm contact now! 
anger,-'For of taking care of my life and will solve your life that is full of problems. 
joy,Untangling the solar Christmas lights to put up! 
neutral," If you ask me , I don ’ t think it ’ s guilty . "
joy,wanna know how i know its winter? my lips are chapped and my hair is static. 
fear,Franco became very alarmed at this and told him to put his money away immediately . 
sadness,When my grandmother died very suddenly without warning.
joy,"The of cycling into work whilst others are stuck on cars, buses and moving boxes xxx metres below ground"
joy,When I met my mother after months of absence.
anger,Lost It &amp; Left A Vmail on the House Phone!! ..
fear,"Stanley Spencer had been through the war ; he had experienced the horror , the vulgarity , of war . "
neutral," Where are you going to work then , in Australia or back in China ? "
anger,When its cold on a bus why do people feel the need to open the windows ? 
surprise,"At a nervous and hurriedly arranged press conference , the Ibrox publicity machine could barely paper the cracks between the departing boss and his bewildered chairman . "
joy,Gettin my health card renewed hate line ups!
joy,I just love being ditched on my last night off. Makes me feel good yu know? 
sadness,"io domani volevo vestirmi tutta figa, ma il mio compagno di classe fa sega quindi è tutto inutile ç---ç "
anger,"` No , "" she replied briefly , feeling more and more resentful . "
neutral, Photograph . 
surprise,Oh the things that catch me off guard. 
surprise,"Only ninety minutes left of work, I hope she likes her little gift bag #iloveher"
anger, Wow ! Why so much ? I thought they were getting you an assistant . 
joy,Fallin asleep with tights on at someone else's house is so fun especially whn he can't find the top of'em! 
joy,&quot;He who dwells n the shelter of the Most High will abide in the shadow of the Almighty.&quot; Ps 91:1 No place I'd rather be! He's &amp; #peace
sadness,"When I feel I must be with somebody, to talk with somebody - but I am alone."
sadness,Sorry I've disappeared from the twitter sphere. I've been too busy to tweet. #illprobablygetfired #7hillsstaff #wetweetsomuch
joy,Woo bad mood 
surprise, roar back to form and it happens at the same time as Wayne Rooney 
surprise,@K_Schaffernoth printed pictures today!! Can't wait to work on the book! 
joy,Gotta love gettin to work on time and the boss... with the keys... is running 20 min late 
joy,I'm going to make home made pecan pie Thursday for Thanksgiving. I'm giving the Irish lads in my house a taste of being American 
anger, You'd better get on with your homework ! You can practice on Sunday . 
sadness, Oh yes ! Sorry ! Then we drive to the M11 motorway . 
joy," Yes , wasn't it funny ? "
surprise,I chuckled at the astonishment on her face . 
joy,Just met a nice group of students camping outside the Schott for tomorrow night's Duke game. Playing cards &amp; eating pizza in the rain. 
joy,Probably about to go freeze my ass off at soccer... #tooexcited
neutral, Just two . 
sadness,Rough morning coming back to work on a yucky day after a 4-day weekend... 
joy,Sitting waiting online to get in the supreme court 
fear,When a big angry dog put its snout on my arm and had I made one movement it would have bitten me.
sadness,to feel happy just once for a whole day would be brilliant 
fear,"miss geng-2 clan , bila la aku bole join korang ? :/"
sadness,@pearce_odom you need to hurry up and come home! I'm craving me some cheese dip! :( 
surprise,I love getting the lights turned off on me when I'm still in the bathroom....  
sadness,Having to go back home form the U.S. after having been there for ten weeks to visit my brother and his family.
anger,HATE PEOPLE THAT ARE STUPID! 
fear,They  should make a second  movie where  wears the ring of 
fear,A certain night during initiation. 
fear,"Dan , Dan , dude . You have to come over to my house right now ! "
sadness,Nails became miserable with anxiety . 
sadness,@ochocinco yeah dude. The album is dopeness to the ear drums. What a talent. What a voice. #MusicEducation
sadness,"During the funeral of my grandmother, when I saw my mother and other family members crying."
joy,When I felt that my love was returned.
surprise,"oh wow im right now , someone is finally waking up"
fear,@Soundplatinum3 Thank you so much for tonight... It was truly a blessing &quot;If God did give then where did it come from&quot; 
surprise,ok voor iedereen ik post strax een foto maar hij is nog niet klaar dus ff wachten! 
joy,Shower break then back to International business 
surprise,"Swimming lost, night in with Mike and hot chocolate won! "
joy,@CUGoldenBears COME take pictures with Comet The Bear in the Pearson Commons from 12-2 PM! :) Christmas pictures!!!  
joy,Gudnyt 2 ma hommies    #Rechael #KapsCarter #Aisha n lovly galfriend #Maddy damn true real friendz
joy,My girlfriend who had been very far away from me came to my place. She saw me and ran after me. I didn't know that she had come. I couldn't see her. She held my shoulders standing behind me.
surprise,"aww. max gaat in de kast liggen en als ik er dan langs loop, valt ie me aan #attack"
joy,White chocolate buttons are heaven 
sadness,We live in a society where pizza gets to your house before the fireman .    
joy,But a dry day would bring bigger crowds and add to the excitement of the vital third round of the tournament . 
fear,People always be hatin on our kind.. And why? Because we could dteal your girl/man from under your arm.. SMH.. 
surprise,Packing my daughters stuff. She is going to her dads house for thanksgiving. Her grandma and uncle are there. She doesnt know. Lol
surprise,"For everyone, that was just a plain lanyard and keychain. But for me, that was his heart and all. :&quot;&gt; "
sadness,"Thought you had. Must have been a careless command-x on my part. RT @SpaceCowboyInLG:  dang, I didn't make the 6 words post. I "
sadness,i wish people actually realized under this bitch attitude..i actually have feelings :( 
joy,"Happy Tweet:  Some think that joy is in short supply.  Rather, it's in short use!!    "
fear,Le fanatisme est flippant même lorsqu'il s'agit de Twilight. Des nanas de 50 piges qui se font tatouer des scènes du film ^^ 
joy,@SparklyBlues77 out on friday then it's a weekend of study.......
surprise,@damnitjason san francisco hippies let that shit get braidable. and do braid it. 
joy,"Break! Imagine the spiritual being you most admire right there with you, telling you that you're doing great, hugging you. #LJB"
joy,Winter is back. Time to start killing those mosquitoes with them otherwise useless textbooks. 
joy,"Detention, then teaching a preschool class at gym full of boys. "
anger,When my sister lost my favourite jumper at a party and failed to tell me for several days after it happened.
sadness,@GC51 morning :) oh what a bad episode to come in towards the end... And only 1 more episode?? 
neutral, Sure . Any time . 
anger,@katieniedz hahaha I meant so my phone changes that to do ALL THE TIME. Last time I checked autocorrect do is a word. 
joy, Yeah . It is incredible ! Is it the work of Qi Bakshi ? 
joy,Enjoy your day today. Catch a dream! ~ MJ Ames  #wisdom #insight #quote
sadness,"Alexei 's expression was anguished , and it was clear that he wished himself elsewhere . "
surprise,waarom kan ik op google niet eens een plaatje van een rood kruisje van een computer (rechtsboven) vinden?! O_o nodig voor !
surprise,Picking up my mom from the airport today and surprising her with Thanksgiving dinner. She thinks she missed it! ;-) 
fear,"@DaveWright70 @rmmanson @GabBurnsSmith @fraudsterboosh bob, would not like to be on your head come Saturday morning ! "
joy,feeling better this morning. sitting through this stupid english class and then going to a meeting for my new job. 
joy,homework and then the gym. then more homework 
joy,Do you have a delight in animals and skill in their management ? 
fear,We're ALL afraid of something here .. bc u ain't human w/o 
fear,"Les choses vont mieux, mais je dois toujours croiser les doigts pour que ça continue d'aller mieux. "
surprise,Cant wait until the mail comes tomorrow. @_kbettag309 knows..
fear,"While watching TV (a war movie), I felt a strong fear of death, threat and fear of loosing people close to me."
joy,"Mrs Thatcher has mastered the sound-bite , to be repeated at intervals like a mantra : ` So very pleased with how it 's going . "" "
joy,When I made the acquaintance of a certain person.
joy,eating like crap and I don't care because I'm getting my wisdom teeth out next week 
fear,"Nevertheless , the Commission 's disquiet has not prevented it from agreeing the designation . "
surprise,"When somebody says, “expect the unexpected”, slap them in the face and say “bet you didn’t expect that, did you?” "
sadness, Oh . I just can ’ t forget it . 
anger,"Kisling was livid , and with the help of some friends managed to grab the sculptor and throw him down the stairwell from the seventh floor . "
neutral, Thank you . 
joy,Always when I meet the person I love.
anger,"@trisharolfe tell veloce... Tell her french fucks people up, and computers alike!  #hate"
sadness, I have to find something.Otherwise I have to go back to Taiwan . I'll be broke in two months . 
joy,Sociology test. I'm so ecstatic with that I'm sweating jelly beans. #sarcasm
joy,On this fine Saturday night I shall be in the gym shootin. With my mother. @Bballgirlsprobs
joy,Can't really talk to anybody but my sister and her phone is broke.. 
sadness,@jullz_isa_chink I legit found out two seconds ago she had drained it 
sadness,How I hate walking away that last time 
sadness,I feel so tired and sick 
joy," Yes , you have many opportunities to grow in this company as long as you do well . "
fear,Watched for the first time last night #Reesewitherspoon and #MarkWallburg  a great performance
fear,Can't wait to watch Factor again #tomorrowat8
surprise,@xkusayca als jij bij de action bent kijk dan even hoeveel de normale pepernoten daar zijn en de chocolade letters 
joy,When I got permission to study at a place which was far away from my home.
fear,"When I got the midterm exam results, the results were below average and were near the lowest.  I was scared of the final exam."
joy,Maybe doing black Friday to see all these crazy people. 
joy,"Off to work, to practice coming out/dumpedness on boss before mum "
joy,got christmas card sparkles everywhere at the office today!  
fear,"Courage is not absence of fear; it is control of fear, mastery of fear. - Mark Twain # courage "
fear,watching say yes to the dress: big bliss... this makes me wanna never get that big #diettime
anger,I came out of the house at 7:20 am Monday morning getting ready t go to school and fight for a parking when I saw my car had a flat tire.
fear,@fr8d c bizarre j'ose même pas dire &quot;pas cap&quot; lol @AnneDiams @caroo59
joy,"When I was able to buy my new car, after lots of problems."
fear,Fear from the unknown. I felt fear when I sat for the entrance examinations.
joy,The two observers exchanged amused glances and then wandered away under the trees . 
sadness," You know , all I was trying to do was tell the truth but they obviously didn ’ t take it that way . "
fear,"When you notice every nurse and dentist around is wearing yellow goggles, "
anger,I'm Ready To Get In The Weight Room. Needa release some 
neutral," Just so so . Last night I met this great guy at the bar and we had such a wonderful time , so we decided to meet again tonight . "
sadness,@BiebersLov WELL. i went to this picture all happy &amp; smiling thinking it would be me &amp; you but NOOOOOOO.... :(
joy," In the evening , we just sit and talk over dinner . But on the weekend , we try to go out to the beach or hit a nice restaurant , or go to a nice cafe . "
surprise,"En heb je problemen (ideeën, adviezen etc.) dan kun je donderdagavond tot 21.00 uur bij ons terecht en wij helpen je verder."
surprise,Get called from secondary school Mr.Ong.H.K   
joy,"When I felt that an exam, which I had feared, was an easy one and went well."
sadness,That was a good game wish the dolphins won though lol 
joy,George Grindal was pleased that he could turn to the bedside cabinet and take up the feeding glass containing orange juice . 
sadness,@Wang_Thai sadly we were not aware of how busy it would be so didn't book @Cheviot_Publish
anger, ha kina nako eish especially wen I have to be with husband angna langa lokge 
sadness,@BiebersLov i have money..........but not alot so i'll prob make an awesome one for you too(; ohhhh what are you doing tonight?
sadness,I'll miss watching Buehrle on the south side. He was my favorite White Sox player. 
joy,And off to work I go...in the rain and wind 
joy,` I am so excited about seeing my sons again . 
sadness,When my grandmother died. She stayed with us until I had the age of 10. When she died I was 13 and I remember the moment after the funeral: I sat on the table and cried.
joy,The Macy's Thanksgiving Day Parade is on! And The Godfather 1 &amp; 2 both come on later today on AMC! Set your DVRs! Happy Thanksgiving
joy,Conditional offer from Queen's! :D Ballin' B) #finally
sadness,When my sister (really my niece) died of cancer at the age of 2 yrs after I took her to the doctor at the age of 1 and he diagnosed it.
anger,"After a day or two , the owner became irked , and went to the airport to inspect his plane . "
surprise,boooooooo @Salzman12 stole my garth christmas tweet @olpoopshoe  i made CDs!
surprise,@ImaDoMe77 well thats funny cause i was just tweeting you telling you to make it to me. YAYYYY! #familyforlife
anger,She would be doubly furious at having been deceived in exactly the same way by two successive men . 
surprise,Heb nu alle kadotjes. Nu nog een idee en uitwerking voor derest 
surprise,"got this feeling now??? a happiness?? RT @Nurdiantolight I Have A Chance,"
sadness," Okay , I'll be right back ... Congratulations ! The manager approved the final price $ 15,000 . "
anger,"Believing that he had no ` right "" to be angry over this mishap , Matthew retreated to his bedroom , took out a penknife and cut a painful slit in his own hand . "
sadness,"He had understood James 's despair at the enormity of the ruin , but not what the loss of Edward was already meaning . "
fear,In 1986 the local authority became concerned about injuries which D had sustained and they obtained a place of safety order . 
anger,"I told my boy friend not to park in a certain place because the car would ger towed away - he didn't listen and it was towed away. At that stage, our finances were below the poverty line & it cost us $10.00 - all the money we had to get us through that week (including rent)."
joy,"He himself was thrilled , but his pleasure was diminished as he imagined Ken 's pallid , bandaged head shadowed on the screen . "
joy,"“Worry never robs tomorrow of its sorrow, it only saps today of its joy.”& Buscaglia&   "
sadness,@CiARAA_liNDSAY6 I knowwww I feel sick thinking about it 
neutral, Okay . 
joy,"It's a beautiful morning here in  I love this drizzle. Means only one thing, morning walk cancelled. YAY "
anger,"I am so pissed off with work today that if I had a gun right now, I'd go on a killing spree and then shoot myself. "
anger,When on a car journey a fellow student crossed our way with his own car and we had to bump into a roadside trunk.
joy,"@linda_sem lol he finally listened, and is currently being a morning grump. "
sadness,"hey @JaimelynArmy, i miss you new friend. "
anger," When I was your age , my parents didn ’ t have central heating like you do ! We had a furnace in the center of the living room and that was it . We used it to cook , heat the house and even dry our clothes ! We never caught a cold . You should be grateful ! "
surprise,Helpful cops!! Wow they still exist!!  and 
joy,"60 min de  pour commencer la journée, ça le fait! "
surprise,Nothing cuter than when a guy actually plans a nice evening @jimjones
